video_id,title,published_at,views,likes,comments,tags,duration_seconds
xb5-UX-jYw0,How to Lie with Data | Averages,2025-04-08T12:01:32Z,2970,168,11,"['Data Analyst', 'Data Analyst job', 'Data Analyst Career', 'Data Analytics', 'Alex The Analyst']",407
V3ouFOBQP0k,How to Lie with Data | Percentages and Baseline Numbers,2025-04-01T12:00:46Z,3688,181,8,"['Data Analyst', 'Data Analyst job', 'Data Analyst Career', 'Data Analytics', 'Alex The Analyst']",318
oi9W142ELN0,1 Million YouTube Play Button Unboxing!,2025-03-25T12:01:10Z,2668,222,76,"['Data Analyst', 'Data Analyst job', 'Data Analyst Career', 'Data Analytics', 'Alex The Analyst']",460
5n52mlp9Ym0,Maven Analytics + Analyst Builder Lifetime Access (Ends March 31st),2025-03-24T12:00:07Z,7654,244,40,"['Data Analyst', 'Data Analyst job', 'Data Analyst Career', 'Data Analytics', 'Alex The Analyst']",315
hgp91KvbJV4,How to Lie with Data | Misleading Graphs,2025-03-18T12:01:07Z,4676,265,22,"['Data Analyst', 'Data Analyst job', 'Data Analyst Career', 'Data Analytics', 'Alex The Analyst']",326
1ql4kNv0_qY,Where to find the Best Healthcare Data,2025-03-11T12:00:02Z,6197,347,22,"['Data Analyst', 'Data Analyst job', 'Data Analyst Career', 'Data Analytics', 'Alex The Analyst']",471
r5512UY3MTc,1 Million Subscriber Livestream!! Giveaways + Chat,2025-03-05T17:07:10Z,9771,675,68,"['Data Analyst', 'Data Analyst job', 'Data Analyst Career', 'Data Analytics', 'Alex The Analyst', 'livestream']",6014
XuOcmjIbFGg,"Taking a look at Real Healthcare Data | ICD11, CPT, HCPCS, Claims",2025-03-04T13:00:44Z,7012,351,27,"['Data Analyst', 'Data Analyst job', 'Data Analyst Career', 'Data Analytics', 'Alex The Analyst']",916
Ka2mDrKEAhg,How to Become a Healthcare Analyst in 2025,2025-02-25T13:00:21Z,20818,1096,78,"['Data Analyst', 'Data Analyst job', 'Data Analyst Career', 'Data Analytics', 'Alex The Analyst']",1072
k8nBWL6K884,What is Healthcare Analytics?,2025-02-18T13:01:11Z,21952,1174,74,"['Data Analyst', 'Data Analyst job', 'Data Analyst Career', 'Data Analytics', 'Alex The Analyst']",656
WpX2F2BS3Qc,What is Data Cleaning? | Data Fundamentals for Beginners,2025-02-11T13:00:47Z,14507,592,24,"['Data Analyst', 'Data Analyst job', 'Data Analyst Career', 'Data Analytics', 'Alex The Analyst']",424
cd_jj0IRmaA,What is Data Collection? | Data Fundamentals for Beginners,2025-02-04T13:00:52Z,9411,430,13,"['Data Analyst', 'Data Analyst job', 'Data Analyst Career', 'Data Analytics', 'Alex The Analyst']",283
OcG0B4ny1cE,What are File Types? | Data Fundamentals for Beginners,2025-01-28T13:00:34Z,7296,297,11,"['Data Analyst', 'Data Analyst job', 'Data Analyst Career', 'Data Analytics', 'Alex The Analyst']",387
hXpt8zj_ajc,What are Data Types? | Data Fundamentals for Beginners,2025-01-21T13:00:55Z,8293,363,18,"['Data Analyst', 'Data Analyst job', 'Data Analyst Career', 'Data Analytics', 'Alex The Analyst']",294
ItZlTixh6Bs,What are KPIs and Metrics? | Data Fundamental for Beginners,2025-01-14T13:00:34Z,14026,782,30,"['Data Analyst', 'Data Analyst job', 'Data Analyst Career', 'Data Analytics', 'Alex The Analyst']",346
PEWMgtu-1e4,What is Data? | Data Fundamentals for Beginners,2025-01-07T13:00:35Z,13842,744,29,"['Data Analyst', 'Data Analyst job', 'Data Analyst Career', 'Data Analytics', 'Alex The Analyst']",416
hCmEfxy-BXg,Is Big Tech Overrated in 2025? | Alex The Analyst Show Episode 28,2024-12-31T13:01:01Z,8492,294,65,"['Data Analyst', 'Data Analyst job', 'Data Analyst Career', 'Data Analytics', 'Alex The Analyst']",2092
TtCBz1lutsY,Most Commonly Asked Questions by Aspiring Data Analysts,2024-12-24T13:00:39Z,13895,688,35,"['Data Analyst', 'Data Analyst job', 'Data Analyst Career', 'Data Analytics', 'Alex The Analyst']",718
Ihmq-qeA5Pc,My Career Progression 7+ Years | Recreational Therapist to Data Analyst | Alex The Analyst Show 27,2024-12-17T13:30:12Z,8081,354,120,"['Data Analyst', 'Data Analyst job', 'Data Analyst Career', 'Data Analytics', 'Alex The Analyst']",2237
wQQR60KtnFY,"Ultimate Data Analyst Bootcamp [24 Hours!] for FREE | SQL, Excel, Tableau, Power BI, Python, Azure",2024-12-10T05:00:49Z,422006,20125,704,"['Data Analyst', 'Data Analyst job', 'Data Analyst Career', 'Data Analytics', 'Alex The Analyst', 'Data analyst bootcamp', 'free data analyst bootcamp', 'data bootcamp', 'sql bootcamp', 'python bootcamp', 'excel bootcamp', 'bootcamp']",84768
oHte3qFa-oY,"Learn AWS for Analytics in Under 2 Hours | S3, Athena, Glue, Glue DataBrew, Quicksight",2024-12-03T13:00:56Z,15746,528,33,"['Data Analyst', 'Data Analyst job', 'Data Analyst Career', 'Data Analytics', 'Alex The Analyst']",6097
P7p2OZj9ewU,"Learn Azure for Analytics in Under 90 Minutes | Azure Synapse Analytics, SQL Databases, ADF + More",2024-11-26T13:00:27Z,12517,320,21,"['Data Analyst', 'Data Analyst job', 'Data Analyst Career', 'Data Analytics', 'Alex The Analyst']",4637
I0vQ_VLZTWg,"Learn Power BI in Under 3 Hours | Formatting, Visualizations, Dashboards + Full Project",2024-11-19T13:00:31Z,178232,3288,132,"['Data Analyst', 'Data Analyst job', 'Data Analyst Career', 'Data Analytics', 'Alex The Analyst']",7518
tnz72ywhCoo,Coding with R and AI Now on Analyst Builder!,2024-11-12T13:01:10Z,5622,181,16,"['Data Analyst', 'Data Analyst job', 'Data Analyst Career', 'Data Analytics', 'Alex The Analyst']",501
j8FSP8XuFyk,"Learn Tableau in Under 2 hours | Dashboards, Relationships, Visualizations + Mini Project",2024-11-05T13:01:16Z,72525,1501,57,"['Data Analyst', 'Data Analyst job', 'Data Analyst Career', 'Data Analytics', 'Alex The Analyst']",5410
zXnQNytHCPM,"Learn Excel in Under 3 Hours | Pivot Tables, Lookups, Data Cleaning",2024-10-29T12:01:19Z,51877,1427,66,"['Data Analyst', 'Data Analyst job', 'Data Analyst Career', 'Data Analytics', 'Alex The Analyst']",9516
osA1QpBcxRs,Nobody cares... so just do it!,2024-10-24T12:17:57Z,16741,1711,58,[],36
Mdq1WWSdUtw,"Learn Pandas in Under 3 Hours | Filtering, Joins, Indexing, Data Cleaning, Visualizations",2024-10-22T12:00:28Z,48380,1286,44,"['Data Analyst', 'Data Analyst job', 'Data Analyst Career', 'Data Analytics', 'Alex The Analyst']",9607
CZt2BUpgjgw,Free Data Analyst Bootcamp 2024,2024-10-17T11:52:50Z,10462,948,39,[],31
t1fQBD4B7xk,"Learn Python in Under 3 Hours | Variables, For Loops, Web Scraping + Full Project",2024-10-15T12:01:10Z,39948,1206,40,"['Data Analyst', 'Data Analyst job', 'Data Analyst Career', 'Data Analytics', 'Alex The Analyst']",9121
OT1RErkfLNQ,Learn SQL Beginner to Advanced in Under 4 Hours,2024-10-08T12:00:27Z,485762,12010,468,"['Data Analyst', 'Data Analyst job', 'Data Analyst Career', 'Data Analytics', 'Alex The Analyst']",14698
rxyLC247h6E,AWS Quicksight | AWS Essentials,2024-10-01T12:00:58Z,16395,259,9,"['Data Analyst', 'Data Analyst job', 'Data Analyst Career', 'Data Analytics', 'Alex The Analyst']",730
AycpRKyRagE,AWS Glue DataBrew and Glue | AWS Essentials,2024-09-24T12:00:16Z,7827,147,12,"['Data Analyst', 'Data Analyst job', 'Data Analyst Career', 'Data Analytics', 'Alex The Analyst', 'aws glue', 'aws glue databrew', 'glue', 'glue aws', 'glue tutorial']",2732
K2GfrERtliU,Amazon Athena in AWS | AWS Fundamentals,2024-09-17T12:00:24Z,11836,231,10,"['Data Analyst', 'Data Analyst job', 'Data Analyst Career', 'Data Analytics', 'Alex The Analyst', 'aws athena', 'athena', 'athena tutorial']",1473
xmVyaT-RuVo,Alex Freberg and Ben Rogojan Livestream | Everything Data Analytics and Data Engineering,2024-09-11T03:20:13Z,5902,198,8,[],4516
amb9bciHGSI,Landing a Data Job Course on Analyst Builder,2024-09-03T12:00:05Z,23734,823,96,"['Data Analyst', 'Data Analyst job', 'Data Analyst Career', 'Data Analytics', 'Alex The Analyst']",500
hgaVi4sOHkM,S3 Storage in AWS | AWS Essentials,2024-08-27T12:00:47Z,8604,179,14,"['Data Analyst', 'Data Analyst job', 'Data Analyst Career', 'Data Analytics', 'Alex The Analyst', 's3', 's3 buckets', 's3 tutorial', 'tutorial for s3', 's3 bucket tutorial']",878
YSjbGET6R1A,AWS Setup and UI Walkthough | AWS,2024-08-20T12:00:41Z,10228,266,15,"['Data Analyst', 'Data Analyst job', 'Data Analyst Career', 'Data Analytics', 'Alex The Analyst', 'aws setup', 'aws account', 'how to setup aws', 'aws ui', 'aws ui walkthrough']",441
vDVcXXfc9e8,Getting Started in Azure Synapse Analytics | Azure Fundamentals,2024-08-13T12:01:05Z,22274,325,14,"['Data Analyst', 'Data Analyst job', 'Data Analyst Career', 'Data Analytics', 'Alex The Analyst', 'azure', 'azure synapse', 'azure synapse analytics', 'synapse analytics tutorials', 'azure synapse tutorial']",1177
Vg6ys_JvXzg,August Q/A Livestream! Come Ask Me Anything!,2024-08-09T15:17:26Z,5301,223,18,"['Data Analyst', 'Data Analyst job', 'Data Analyst Career', 'Data Analytics', 'Alex The Analyst', 'livestream']",5904
sge9qTf8GdY,Getting Started in Azure Data Factory | Azure Fundamentals,2024-08-06T12:00:57Z,27301,444,23,"['Data Analyst', 'Data Analyst job', 'Data Analyst Career', 'Data Analytics', 'Alex The Analyst', 'azure', 'azure data factory', 'azure data factory tutorial']",1471
9ur0OpMADuM,How to use Azure SQL Databases | Azure Fundamentals,2024-07-30T12:00:10Z,32765,599,20,"['Data Analyst', 'Data Analyst job', 'Data Analyst Career', 'Data Analytics', 'Alex The Analyst', 'azure', 'azure sql databases', 'sql databases in azure']",826
UTMuL_86gSQ,Complete Data Analyst Roadmap on Analyst Builder | Become a Data Analyst Faster!,2024-07-25T12:00:34Z,53614,1539,162,"['Data Analyst', 'Data Analyst job', 'Data Analyst Career', 'Data Analytics', 'Alex The Analyst']",367
sEImMaovc1Q,Blob Storage and Storage Accounts in Azure | Azure Fundamentals,2024-07-23T12:01:00Z,11150,215,10,"['Data Analyst', 'Data Analyst job', 'Data Analyst Career', 'Data Analytics', 'Alex The Analyst', 'azure storage accounts', 'azure storage', 'azure', 'azure storing data']",941
ZYps6TmBkWk,Azure Account Setup + $200 Free Credits | Azure Fundamentals,2024-07-16T12:00:38Z,19518,444,29,"['Data Analyst', 'Data Analyst job', 'Data Analyst Career', 'Data Analytics', 'Alex The Analyst', 'azure', 'azure setup', 'azure ui', 'azure walkthrough']",397
zv1nfZTYpio,Building a Fully Interactive Web App using Shiny for Python,2024-07-09T12:01:07Z,13789,366,24,"['Data Analyst', 'Data Analyst job', 'Data Analyst Career', 'Data Analytics', 'Alex The Analyst', 'shiny project', 'shiny full project', 'shiny tutorial']",3592
rn0dSsYXhIE,Shiny for Python Components and Layouts | Customizing You Web App,2024-07-02T12:01:00Z,5709,163,10,"['Data Analyst', 'Data Analyst job', 'Data Analyst Career', 'Data Analytics', 'Alex The Analyst', 'shiny', 'shiny components', 'shiny layouts', 'shiny tutorials']",1448
siHou7lObbo,Shiny for Python Setup and Install | Deploying First Shiny App,2024-06-25T12:00:53Z,12511,313,36,"['Data Analyst', 'Data Analyst job', 'Data Analyst Career', 'Data Analytics', 'Alex The Analyst', 'shiny', 'shiny for python', 'python shiny', 'shiny for python setup', 'shiny setup']",864
wJiJXD7MVoY,Is the Economy on the Brink of a Recession? | Let's Look at the Data!,2024-06-18T12:00:06Z,13635,809,132,"['Data Analyst', 'Data Analyst job', 'Data Analyst Career', 'Data Analytics', 'Alex The Analyst', 'economy', 'economic data', 'how is the economy doing', 'economy data', 'data about economy', 'will economy get better', 'will economy get worse']",1279
BzwAZ1k3WEY,Top 5 Most Common Excel Functions in Excel,2024-06-11T12:00:10Z,8654,375,9,"['Data Analyst', 'Data Analyst job', 'Data Analyst Career', 'Data Analytics', 'Alex The Analyst']",1007
5q2u8__sVhs,5 Awesome Excel Functions You've Probably Never Heard Of,2024-06-04T12:00:09Z,6140,238,17,"['Data Analyst', 'Data Analyst job', 'Data Analyst Career', 'Data Analytics', 'Alex The Analyst']",844
UJbNEH0_nGY,How to Create Custom Functions in Excel | Lambda Functions,2024-05-28T12:00:23Z,6855,232,10,"['Data Analyst', 'Data Analyst job', 'Data Analyst Career', 'Data Analytics', 'Alex The Analyst']",994
oz2K4HUNMW4,Top 5 Most Popular Functions In Microsoft Excel,2024-05-21T12:00:53Z,15775,448,27,"['Data Analyst', 'Data Analyst job', 'Data Analyst Career', 'Data Analytics', 'Alex The Analyst', 'Excel', 'Microsoft Excel', 'Functions in excel']",992
Y-4ri9QjsTI,Infrastructure of Analyst Builder | Entire Tech Stack | Part 3,2024-05-14T12:00:28Z,5576,88,10,"['Data Analyst', 'Data Analyst job', 'Data Analyst Career', 'Data Analytics', 'Alex The Analyst']",2740
F5v2dRYU5IA,2 Hour Data Analyst Interview Masterclass | Interview Better Than The Competition,2024-05-07T15:16:53Z,98834,3146,77,"['Data Analyst', 'Data Analyst job', 'Data Analyst Career', 'Data Analytics', 'Alex The Analyst', 'livestream']",7480
_R6K1aNtKpE,Challenges of Creating Analyst Builder | Challenges of a Startup | Part 2,2024-05-07T12:00:30Z,2506,65,11,"['Data Analyst', 'Data Analyst job', 'Data Analyst Career', 'Data Analytics', 'Alex The Analyst']",2707
5tKmTdvEAVk,How We Started Analyst Builder | How We Created It | Part 1,2024-04-30T12:00:07Z,6667,213,35,"['Data Analyst', 'Data Analyst job', 'Data Analyst Career', 'Data Analytics', 'Alex The Analyst']",1367
QYd-RtK58VQ,MySQL Exploratory Data Analysis | Full Project,2024-04-23T12:00:21Z,114019,2734,131,"['Data Analyst', 'Data Analyst job', 'Data Analyst Career', 'Data Analytics', 'Alex The Analyst']",1964
c5ko0sedE7k,750k Subscriber Livestream! | Giveaways | Songs | Q/A,2024-04-18T18:35:41Z,5186,229,14,"['Data Analyst', 'Data Analyst job', 'Data Analyst Career', 'Data Analytics', 'Alex The Analyst', 'livestream']",4996
4UltKCnnnTA,Data Cleaning in MySQL | Full Project,2024-04-16T12:00:05Z,270929,5998,865,"['Data Analyst', 'Data Analyst job', 'Data Analyst Career', 'Data Analytics', 'Alex The Analyst']",3071
BV5ckMNNvi4,How to get Promoted as a Data Analyst | Alex The Analyst Show Episode 26,2024-04-09T12:00:08Z,8913,281,83,"['Data Analyst', 'Data Analyst job', 'Data Analyst Career', 'Data Analytics', 'Alex The Analyst']",3374
QMUZ5HfWMRc,Triggers and Events in MySQL | Advanced MySQL Series,2024-04-02T12:00:19Z,97516,3244,124,"['Data Analyst', 'Data Analyst job', 'Data Analyst Career', 'Data Analytics', 'Alex The Analyst']",882
7b8ViCqD9JM,How to give up on the job search fast,2024-03-27T12:19:35Z,26819,2038,30,"['Data Analyst', 'Data Analyst job', 'Data Analyst Career', 'Data Analytics', 'Alex The Analyst']",52
7vnxpcqmqNQ,Stored Procedures in MySQL | Advanced MySQL Series,2024-03-26T12:00:12Z,102853,2006,72,"['Data Analyst', 'Data Analyst job', 'Data Analyst Career', 'Data Analytics', 'Alex The Analyst']",757
uEk07jXdKOo,Temp Tables in MySQL | Advanced MySQL Series,2024-03-19T12:00:56Z,70671,1499,57,"['Data Analyst', 'Data Analyst job', 'Data Analyst Career', 'Data Analytics', 'Alex The Analyst']",466
UC7uvOqcUTs,CTEs in MySQL | Advanced MySQL Series,2024-03-12T12:00:23Z,119963,2014,64,"['Data Analyst', 'Data Analyst job', 'Data Analyst Career', 'Data Analytics', 'Alex The Analyst']",631
1KEbiqRWOkA,7 Mistakes to Avoid During Your Data Analyst Job Search,2024-03-05T13:00:01Z,19752,745,50,"['Data Analyst', 'Data Analyst job', 'Data Analyst Career', 'Data Analytics', 'Alex The Analyst']",714
UOBTLzWY1vs,#DataAnalyst #AnalystBuilder #SQL,2024-03-01T13:43:29Z,20954,1485,17,[],38
8zOkBTs0yxs,Q/A Livestream | February Livestream | Ask Me Anything!,2024-02-29T17:10:18Z,5615,190,7,"['Data Analyst', 'Data Analyst job', 'Data Analyst Career', 'Data Analytics', 'Alex The Analyst', 'livestream']",5697
7NBt0V8ebGk,Window Functions in MySQL | Intermediate MySQL,2024-02-27T13:00:08Z,137723,3810,111,"['Data Analyst', 'Data Analyst job', 'Data Analyst Career', 'Data Analytics', 'Alex The Analyst']",809
FGC0cCAgGu0,Twitter making me tear up over here 🥹,2024-02-23T13:34:27Z,7129,302,12,[],16
Vj6RqA_X-IE,Subqueries in MySQL | Intermediate MySQL,2024-02-20T13:00:32Z,115643,1904,75,"['Data Analyst', 'Data Analyst job', 'Data Analyst Career', 'Data Analytics', 'Alex The Analyst']",661
RYIiOG4LsvQ,Case Statements in MySQL | Intermediate MySQL,2024-02-13T13:00:19Z,104199,1852,93,"['Data Analyst', 'Data Analyst job', 'Data Analyst Career', 'Data Analytics', 'Alex The Analyst']",533
5y7tLNPVJPA,We did our best,2024-02-08T13:59:09Z,6726,234,5,[],9
_nf56aMPdZE,"Microsoft Copilot Full Review | AI in Word, PowerPoint, Excel and More!",2024-02-06T13:00:35Z,85097,1023,51,"['Data Analyst', 'Data Analyst job', 'Data Analyst Career', 'Data Analytics', 'Alex The Analyst']",1485
XbDRYzYUmMo,Top 5 Emerging Trends in 2024 | CareerFoundry Webinar,2024-01-30T17:30:05Z,13429,474,10,"['Data Analyst', 'Data Analyst job', 'Data Analyst Career', 'Data Analytics', 'Alex The Analyst']",4496
KRXSJb9ql1Y,String Functions in MySQL | Intermediate MySQL Series,2024-01-30T13:00:17Z,115995,2029,65,"['Data Analyst', 'Data Analyst job', 'Data Analyst Career', 'Data Analytics', 'Alex The Analyst']",714
iTQW_nDp938,Unions in MySQL | Intermediate MySQL,2024-01-23T13:00:41Z,111841,2050,74,"['Data Analyst', 'Data Analyst job', 'Data Analyst Career', 'Data Analytics', 'Alex The Analyst']",442
lXQzD09BOH0,Joins in MySQL | Intermediate MySQL,2024-01-16T13:00:42Z,235384,3402,147,"['Data Analyst', 'Data Analyst job', 'Data Analyst Career', 'Data Analytics', 'Alex The Analyst']",1031
xtC3212t4hI,Is my background in Data Analytics?,2024-01-15T14:22:09Z,28188,1969,29,"['Data Analyst', 'Data Analyst job', 'Data Analyst Career', 'Data Analytics', 'Alex The Analyst']",57
KZKizyBS9YM,Solving VERY HARD SQL Interview Questions on Analyst Builder,2024-01-11T13:00:16Z,21447,545,22,"['Data Analyst Career', 'Data Analytics', 'Alex The Analyst', 'Analyst Builder', 'Analyst Builder Questions', 'Analyst Builder Courses', 'SQL Technical Interview Questions', 'SQL Interview Questions', 'SQL Questions', 'hard sql interview questions', 'Easy sql interview questions', 'medium sql interview questions', 'interview questions', 'technical interview questions', 'technical interview practice', 'sql technical interview practice website', 'website to practice for technical interviews']",1023
I0_ca6iyo6w,Solving HARD SQL Interview Questions on Analyst Builder,2024-01-09T13:00:24Z,28828,590,36,"['Data Analyst Career', 'Data Analytics', 'Alex The Analyst', 'Analyst Builder', 'Analyst Builder Questions', 'Analyst Builder Courses', 'SQL Technical Interview Questions', 'SQL Interview Questions', 'SQL Questions', 'hard sql interview questions', 'Easy sql interview questions', 'medium sql interview questions', 'interview questions', 'technical interview questions', 'technical interview practice', 'sql technical interview practice website', 'website to practice for technical interviews']",1286
GZS7AgQ4Ksg,Hard Skills vs Soft Skills,2024-01-08T13:06:02Z,14361,1013,7,"['Data Analyst', 'Data Analyst job', 'Data Analyst Career', 'Data Analytics', 'Alex The Analyst']",30
fT-8mRf_-Hk,Solving Medium SQL Interview Questions on Analyst Builder,2024-01-04T13:00:28Z,31417,707,48,"['Data Analyst Career', 'Data Analytics', 'Alex The Analyst', 'Analyst Builder', 'Analyst Builder Questions', 'Analyst Builder Courses', 'SQL Technical Interview Questions', 'SQL Interview Questions', 'SQL Questions', 'hard sql interview questions', 'Easy sql interview questions', 'medium sql interview questions', 'interview questions', 'technical interview questions', 'technical interview practice', 'sql technical interview practice website', 'website to practice for technical interviews']",744
ZHaYOC0H5KE,Solving Easy SQL Interview Questions on Analyst Builder,2024-01-02T13:00:25Z,56458,1287,58,"['Data Analyst Career', 'Data Analytics', 'Alex The Analyst', 'Analyst Builder', 'Analyst Builder Questions', 'Analyst Builder Courses', 'SQL Technical Interview Questions', 'SQL Interview Questions', 'SQL Questions', 'hard sql interview questions', 'Easy sql interview questions', 'medium sql interview questions', 'interview questions', 'technical interview questions', 'technical interview practice', 'sql technical interview practice website', 'website to practice for technical interviews']",738
K0-8G3DgjA4,How I Would Become a Data Analyst if I had to Start Over in 2024 | 6 Month Plan,2023-12-26T13:00:10Z,401835,15992,488,"['Data Analyst', 'Data Analyst job', 'Data Analyst Career', 'Data Analytics', 'Alex The Analyst', 'become a data analyst', 'how to become a data analyst', 'what is a data analyst']",661
ZnAydTqCtFU,Limit + Aliasing in MySQL | MySQL Beginner Series,2023-12-19T13:00:24Z,120572,2313,80,"['Data Analyst', 'Data Analyst job', 'Data Analyst Career', 'Data Analytics', 'Alex The Analyst']",237
qPOmj22QX04,Practice SQL and Python right on your Phone!,2023-12-13T16:12:42Z,9540,628,20,[],28
XD1ul5fpnGI,Analyst Builder Full Launch! | The Learning Platform Built for Data Analysts,2023-12-12T13:00:21Z,24656,1020,110,"['Data Analyst', 'Data Analyst job', 'Data Analyst Career', 'Data Analytics', 'Alex The Analyst']",987
kifhSqep9UM,Analyst Builder Full Launch LiveStream | 20% Off Code & Giveaways,2023-12-11T19:04:05Z,11988,475,14,"['Data Analyst', 'Data Analyst job', 'Data Analyst Career', 'Data Analytics', 'Alex The Analyst']",16464
dCNjUOc1cBY,Having vs Where in MySQL | Beginner MySQL Series,2023-12-05T13:00:35Z,141044,2534,44,"['Data Analyst', 'Data Analyst job', 'Data Analyst Career', 'Data Analytics', 'Alex The Analyst']",226
lEjmgE-hogg,#Excel is Frustrating,2023-11-29T18:00:02Z,12035,789,9,"['Data Analyst', 'Data Analyst job', 'Data Analyst Career', 'Data Analytics', 'Alex The Analyst']",47
qxj3dx0c7RM,7 Mistakes to Avoid in Your Data Analytics Job Search | CareerFoundry Webinar,2023-11-28T17:36:39Z,14232,433,11,"['Data Analyst', 'Data Analyst job', 'Data Analyst Career', 'Data Analytics', 'Alex The Analyst']",4297
zgYqUP_PhQo,Group By + Order By in MySQL | Beginner MySQL Series,2023-11-28T13:00:57Z,188921,3312,78,"['Data Analyst', 'Data Analyst job', 'Data Analyst Career', 'Data Analytics', 'Alex The Analyst']",646
MARn_mssG4A,Where Clause in MySQL | Beginner MySQL Series,2023-11-21T13:00:24Z,205635,3331,118,"['Data Analyst', 'Data Analyst job', 'Data Analyst Career', 'Data Analytics', 'Alex The Analyst']",747
TGAUZQJaQbQ,Why Data Analysts Hate Using Excel,2023-11-14T13:00:21Z,25907,970,144,"['Data Analyst', 'Data Analyst job', 'Data Analyst Career', 'Data Analytics', 'Alex The Analyst']",444
HYD8KjPB9F8,Select Statement in MySQL | Beginner MySQL Series,2023-11-07T13:00:11Z,322193,4097,145,"['Data Analyst', 'Data Analyst job', 'Data Analyst Career', 'Data Analytics', 'Alex The Analyst']",660
wgRwITQHszU,Installing MySQL and Creating Databases | MySQL for Beginners,2023-10-31T12:00:54Z,938996,12262,1296,"['Data Analyst', 'Data Analyst job', 'Data Analyst Career', 'Data Analytics', 'Alex The Analyst']",724
1LG65qXfeQY,Python Beginner to Advanced in One Hour | CareerFoundry Webinar,2023-10-26T16:30:05Z,26451,993,12,"['Data Analyst', 'Data Analyst job', 'Data Analyst Career', 'Data Analytics', 'Alex The Analyst']",4709
QzLz-W29Tww,How to Start a Data YouTube Channel,2023-10-24T12:00:30Z,9605,430,47,"['Data Analyst', 'Data Analyst job', 'Data Analyst Career', 'Data Analytics', 'Alex The Analyst']",657
ukIUVW2E-n0,600k Livestream! | Analyst Builder Giveaways | Songs | My Mom is Joining!,2023-10-20T16:18:10Z,5153,238,11,"['Data Analyst', 'Data Analyst job', 'Data Analyst Career', 'Data Analytics', 'Alex The Analyst', 'livestream']",5107
aofB2t5o2ao,Consulting and Freelancing in Data Analytics | ATA Show: Episode 25,2023-10-17T12:00:04Z,18825,699,257,"['Data Analyst', 'Data Analyst job', 'Data Analyst Career', 'Data Analytics', 'Alex The Analyst']",4443
-DwpkgtJjGw,Data Analyst vs Business Analyst,2023-10-13T13:37:21Z,118105,6545,47,"['Data Analyst', 'Data Analyst job', 'Data Analyst Career', 'Data Analytics', 'Alex The Analyst']",59
h4KTy2wxYcQ,First Look at Analyst Builder! | The All-in-One Platform for Data Analysts | Beta Launch Coming Soon,2023-10-10T12:00:36Z,32267,857,212,"['Data Analyst', 'Data Analyst job', 'Data Analyst Career', 'Data Analytics', 'Alex The Analyst']",1311
LaRXtE4OG9A,#DataAnalysis #DataAnalyst #DataRealities,2023-10-09T12:11:16Z,28229,1740,25,"['Data Analyst', 'Data Analyst job', 'Data Analyst Career', 'Data Analytics', 'Alex The Analyst']",40
J0PcCv9f4JQ,#DataAnalyst #DataCareers #DataAnalysis,2023-10-05T12:13:45Z,17083,1296,32,"['Data Analyst', 'Data Analyst job', 'Data Analyst Career', 'Data Analytics', 'Alex The Analyst']",58
_DGn-7134i0,"Data Analyst vs Data Engineer | Responsibilities, Salaries, Skills, Education",2023-10-03T12:00:26Z,37228,802,43,"['Data Analyst', 'Data Analyst job', 'Data Analyst Career', 'Data Analytics', 'Alex The Analyst']",386
EflE8U30pBo,Data Analyst Q/A Livestream | September Livestream | Ask Me Anything!,2023-09-28T16:09:03Z,8990,284,21,"['Data Analyst', 'Data Analyst job', 'Data Analyst Career', 'Data Analytics', 'Alex The Analyst', 'livestream']",5621
j_sHaBJEHMk,#Salary #DataAnalyst #SalaryNegotiation,2023-09-28T12:37:36Z,13891,961,7,"['Data Analyst', 'Data Analyst job', 'Data Analyst Career', 'Data Analytics', 'Alex The Analyst']",55
xuyKzpJ2SaY,AI and Analytics with SAS | SAS Explore Recap,2023-09-26T12:00:49Z,22055,491,31,"['Data Analyst', 'Data Analyst job', 'Data Analyst Career', 'Data Analytics', 'Alex The Analyst']",179
D0mEy6bJ2lA,My Very First Video,2023-09-25T13:13:18Z,9231,500,29,"['Data Analyst', 'Data Analyst job', 'Data Analyst Career', 'Data Analytics', 'Alex The Analyst']",23
GaoAc3-hScQ,#DataAnalyst #CareerPath,2023-09-22T11:45:01Z,55832,3822,27,"['Data Analyst', 'Data Analyst job', 'Data Analyst Career', 'Data Analytics', 'Alex The Analyst']",52
bxIF9X9k2IE,"Data Analyst vs Data Scientist | Responsibilities, Salaries, Skills, Education",2023-09-19T12:00:34Z,47291,1160,54,"['Data Analyst', 'Data Analyst job', 'Data Analyst Career', 'Data Analytics', 'Alex The Analyst']",673
z_xWpa88R0A,#Excel #DataAnalyst #DataAnalysis,2023-09-18T11:38:11Z,15876,1230,20,"['Data Analyst', 'Data Analyst job', 'Data Analyst Career', 'Data Analytics', 'Alex The Analyst']",56
