video_id,title,published_at,views,likes,comments,tags,duration_seconds
7PoZBuIUnEU,"Data Analyst vs Business Analyst | Responsibilities, Salaries, Skills, Education",2023-09-12T12:00:07Z,46862,1635,101,"['Data Analyst', 'Data Analyst job', 'Data Analyst Career', 'Data Analytics', 'Alex The Analyst']",294
fq1-e-GbihE,#DataAnalysis #DataAnalyst,2023-09-07T11:57:32Z,20536,1482,23,"['Data Analyst', 'Data Analyst job', 'Data Analyst Career', 'Data Analytics', 'Alex The Analyst']",53
Xkb6h3YXl_c,Hard Skills vs Soft Skills in the Data World | Which is More Important?,2023-09-05T12:00:34Z,15596,698,30,"['Data Analyst', 'Data Analyst job', 'Data Analyst Career', 'Data Analytics', 'Alex The Analyst']",582
qDprq7Xbrqw,"Entry Level vs Mid Level vs Senior Level Data Analyst | Responsibilities, Salary, Education, Skills",2023-08-29T04:00:33Z,44658,1931,112,"['Data Analyst', 'Data Analyst job', 'Data Analyst Career', 'Data Analytics', 'Alex The Analyst']",323
UOHxb9ndpMM,#DataAnalyst #DataAnalysis #Promotion,2023-08-28T11:53:52Z,10764,633,10,"['Data Analyst', 'Data Analyst job', 'Data Analyst Career', 'Data Analytics', 'Alex The Analyst']",51
_h_A_n8Z9QQ,#DataAnalyst #DataAnalysis,2023-08-24T11:53:05Z,20599,1391,54,"['Data Analyst', 'Data Analyst job', 'Data Analyst Career', 'Data Analytics', 'Alex The Analyst']",60
_oCUSMX4_3k,Regular Expression Use Cases in Python,2023-08-22T12:00:35Z,10858,262,21,"['Data Analyst', 'Data Analyst job', 'Data Analyst Career', 'Data Analytics', 'Alex The Analyst', 'python', 'python regular expression', 'regular expression', 'regular expression use cases']",767
OnS01G8W6nw,Data Analyst Q/A Livestream | August Livestream | Ask Me Anything!,2023-08-18T14:23:24Z,8501,323,25,"['Data Analyst', 'Data Analyst job', 'Data Analyst Career', 'Data Analytics', 'Alex The Analyst', 'livestream']",4365
ugkyfUTc6AU,#DataAnalystSalary #DataAnalysis,2023-08-17T12:35:34Z,45414,3366,49,"['Data Analyst', 'Data Analyst job', 'Data Analyst Career', 'Data Analytics', 'Alex The Analyst']",54
eON-PNPae8Y,How to Work with Recruiters on LinkedIn,2023-08-15T12:00:34Z,46750,2264,85,"['Data Analyst', 'Data Analyst job', 'Data Analyst Career', 'Data Analytics', 'Alex The Analyst']",467
41nX2ZgGzcE,#dataanalysis #dataportfolio,2023-08-14T12:12:00Z,33341,2886,25,"['Data Analyst', 'Data Analyst job', 'Data Analyst Career', 'Data Analytics', 'Alex The Analyst']",60
Le35Qsgs2lM,#wife #careerchange #dataanalysis,2023-08-11T13:13:22Z,20692,1936,51,[],59
nufF-juSZxU,LINK: https://www.youtube.com/playlist?list=PLUaB-1hjhk8FE_XZ87vPPSfHqb6OcM0cF,2023-08-09T13:11:45Z,7921,746,46,"['Data Analyst', 'Data Analyst job', 'Data Analyst Career', 'Data Analytics', 'Alex The Analyst', 'Data Analyst Bootcamp']",37
9NB5u17qiDY,Regular Expression Character Classes in Python,2023-08-08T12:00:05Z,13341,229,13,"['Data Analyst', 'Data Analyst job', 'Data Analyst Career', 'Data Analytics', 'Alex The Analyst', 'regular expression character classes', 'regular expression', 'python regular expression']",638
YDvJqgBv0Uc,#Recruiters #dataanalysis #data,2023-08-03T11:56:30Z,16710,1147,24,[],58
j6A28L6Tmxw,Regular Expression Metacharacters in Python,2023-08-01T12:00:26Z,11699,286,9,"['Data Analyst', 'Data Analyst job', 'Data Analyst Career', 'Data Analytics', 'Alex The Analyst', 'regular expression', 'python regular expression', 'regular expression metacharacters']",1203
W_s4c1vLGXM,How much do Data Analysts make? #dataanalyst #dataanalystsalary,2023-07-31T13:07:06Z,21684,837,45,[],46
DWte9zjGl0I,Do you need to learn SQL if you can do everything in Python?  #Python #dataanalysis #SQL,2023-07-28T12:48:19Z,55290,3157,47,"['Data Analyst', 'Data Analyst job', 'Data Analyst Career', 'Data Analytics', 'Alex The Analyst']",51
EzeeypMKx7o,Regular Expression Methods in Python,2023-07-25T12:00:19Z,19844,410,14,"['Data Analyst', 'Data Analyst job', 'Data Analyst Career', 'Data Analytics', 'Alex The Analyst', 'Python regular expression', 'regular expression', 'regular expression methods']",517
OISvlkfbntY,What are Hiring Managers Looking For? | Nail the Interview Process!,2023-07-18T12:00:17Z,39919,1470,73,"['Data Analyst', 'Data Analyst job', 'Data Analyst Career', 'Data Analytics', 'Alex The Analyst']",822
8dTpNajxaH0,Scraping Data from a Real Website | Web Scraping in Python,2023-07-11T12:00:07Z,622499,11105,431,"['Data Analyst', 'Data Analyst job', 'Data Analyst Career', 'Data Analytics', 'Alex The Analyst', 'python', 'python web scraping', 'how to web scrape', 'web scraping in python']",1523
oreAsJTNcsA,SQL Beginner to Advanced in One Hour | CareerFoundry Webinar,2023-07-06T17:20:05Z,234282,6595,120,"['Data Analyst', 'Data Analyst job', 'Data Analyst Career', 'Data Analytics', 'Alex The Analyst']",4108
xjA1HjvmoMY,Find and Find_All | Web Scraping in Python,2023-07-04T12:00:49Z,83962,2144,38,"['Data Analyst', 'Data Analyst job', 'Data Analyst Career', 'Data Analytics', 'Alex The Analyst', 'python', 'python web scraping', 'web scraping with python', 'find and find_all']",730
LO7hzmoHEIE,500k Livestream!!,2023-06-28T17:11:25Z,6280,383,24,"['Data Analyst', 'Data Analyst job', 'Data Analyst Career', 'Data Analytics', 'Alex The Analyst', 'livestream']",6232
bargNl2WeN4,BeautifulSoup + Requests | Web Scraping in Python,2023-06-27T12:00:28Z,200111,3537,75,"['Data Analyst', 'Data Analyst job', 'Data Analyst Career', 'Data Analytics', 'Alex The Analyst', 'python', 'python web scraping', 'beautifulsoup', 'requests', 'beautifulsoup and requests']",418
q-kbzWjyPak,Inspecting Web Pages with HTML | Web Scraping in Python,2023-06-20T12:00:43Z,81195,1989,39,"['Data Analyst', 'Data Analyst job', 'Data Analyst Career', 'Data Analytics', 'Alex The Analyst', 'python', 'python web scraping', 'web scraping in python']",355
PExdWWcxmro,Best Places to Find Datasets for Your Projects,2023-06-13T12:00:16Z,207163,5209,96,"['Data Analyst', 'Data Analyst job', 'Data Analyst Career', 'Data Analytics', 'Alex The Analyst']",464
Liv6eeb1VfE,Exploratory Data Analysis in Pandas | Python Pandas Tutorials,2023-06-06T12:00:14Z,179176,4053,233,"['Data Analyst', 'Data Analyst job', 'Data Analyst Career', 'Data Analytics', 'Alex The Analyst', 'pandas', 'pandas python', 'python pandas', 'pandas tutorial', 'eda in python', 'eda in pandas', 'pandas eda', 'eda pandas', 'exploratory data analysis', 'exploratory data analysis in pandas']",1933
fHK4nHbUtj0,Data Analyst Q/A Livestream | May Livestream | Ask Me Anything!,2023-05-30T16:34:20Z,10263,365,20,"['Data Analyst', 'Data Analyst job', 'Data Analyst Career', 'Data Analytics', 'Alex The Analyst', 'livestream']",5548
5l2d_Rv0odE,What is Microsoft Fabric? | New Data Analytics Platform!,2023-05-29T12:00:07Z,298872,5674,156,"['Data Analyst', 'Data Analyst job', 'Data Analyst Career', 'Data Analytics', 'Alex The Analyst']",443
bDhvCp3_lYw,Data Cleaning in Pandas | Python Pandas Tutorials,2023-05-23T12:30:17Z,399816,9551,457,"['Data Analyst', 'Data Analyst job', 'Data Analyst Career', 'Data Analytics', 'Alex The Analyst', 'pandas', 'pandas tutorials', 'python pandas', 'pandas python', 'data cleaning', 'data cleaning in pandas', 'data cleaning in python', 'how to clean data', 'pandas data cleaning']",2317
IMU1V-JugKo,The Ultimate Data Analytics Career Plan for 2023 | CareerFoundry Webinar,2023-05-16T16:18:56Z,58971,1885,52,"['Data Analyst', 'Data Analyst job', 'Data Analyst Career', 'Data Analytics', 'Alex The Analyst']",4248
FpgkpjSyBOw,State of AI in Analytics | Will AI be the End of Data Analysts?,2023-05-15T12:30:11Z,46451,1380,377,"['Data Analyst', 'Data Analyst job', 'Data Analyst Career', 'Data Analytics', 'Alex The Analyst', 'AI Analytics', 'Analytics in AI']",4352
6jtS3Hz19kc,Google Bard Got An Upgrade! + Google's New AI Announcements!,2023-05-12T12:15:00Z,33379,799,80,"['Data Analyst', 'Data Analyst job', 'Data Analyst Career', 'Data Analytics', 'Alex The Analyst', 'Google Bard', 'Bard', 'Bard AI', 'Bard Google', 'Bard Chatbot', 'Google ChatBot', 'Google I/O Conference', 'Google IO', 'Google I/O', 'Google Conference', 'Google Developer Conference', 'ChatGPT vs Bard', 'Bard vs ChatGPT', 'ChatGPT', 'ChatGPT Competitors']",521
JpSMse3eVVg,Creating Visualizations using Pandas Library | Python Pandas Tutorials,2023-05-09T11:30:06Z,88728,1954,45,"['Data Analyst', 'Data Analyst job', 'Data Analyst Career', 'Data Analytics', 'Alex The Analyst', 'visualizations in pandas', 'pandas', 'pandas tutorials', 'charts in pandas', 'pandas visualization']",1010
TPivN7tpdwc,Merging DataFrames in Pandas | Python Pandas Tutorials,2023-05-02T12:06:33Z,141130,3058,82,"['Data Analyst', 'Data Analyst job', 'Data Analyst Career', 'Data Analytics', 'Alex The Analyst', 'pandas merge', 'merge pandas', 'pandas', 'pandas tutorial', 'join pandas', 'join in pandas', 'concatenate in pandas', 'concatenate pandas']",1329
kky9MMydnOA,Data Analyst Q/A Livestream | April Livestream | Ask Me Anything!,2023-04-27T16:32:02Z,10320,339,27,"['Data Analyst', 'Data Analyst job', 'Data Analyst Career', 'Data Analytics', 'Alex The Analyst', 'livestream']",5944
2izXQUoXyjA,How to Integrate ChatGPT in Jupyter Notebooks for Free!,2023-04-25T11:30:01Z,64312,1240,60,"['Data Analyst', 'Data Analyst job', 'Data Analyst Career', 'Data Analytics', 'Alex The Analyst', 'Chatgpt', 'Jupyter notebooks', 'Add ChatGPT', 'ChatGPT in Jupyter Notebooks']",481
zilfrWwbteQ,7 Ways to Use ChatGPT for Analytics | Webinar,2023-04-18T16:18:50Z,39288,1078,31,"['Data Analyst', 'Data Analyst job', 'Data Analyst Career', 'Data Analytics', 'Alex The Analyst']",4135
PJINexERxOs,Google Business Intelligence Professional Certification Review,2023-04-18T11:30:08Z,46058,1254,74,"['Data Analyst', 'Data Analyst job', 'Data Analyst Career', 'Data Analytics', 'Alex The Analyst', 'Google certifications', 'Google Business Certification', 'Google Business Intelligence Certification on Course', 'Coursera Google Certification']",424
gTf2GLEhKgA,Google Advanced Data Analytics Professional Certificate First Look | Is it Worth it?,2023-04-10T11:30:21Z,158290,4498,413,"['Data Analyst', 'Data Analyst job', 'Data Analyst Career', 'Data Analytics', 'Alex The Analyst', 'Google Certification', 'Google Data Analyst', 'Google Data Analyst Certification', 'Google Advanced Data Analyst', 'Google Advanced Data analytics', 'Google Advanced Data Analytics Certification', 'Google Advanced Data Analytics Certification Review']",695
VRmXto2YA2I,Group By and Aggregate Functions in Pandas | Python Pandas Tutorials,2023-04-04T11:30:10Z,112844,2737,130,"['Data Analyst', 'Data Analyst job', 'Data Analyst Career', 'Data Analytics', 'Alex The Analyst', 'pandas', 'pandas group by', 'group by in pandas', 'aggregating in pandas', 'agg pandas', 'pandas agg', 'pangas group_by', 'groupby pandas', 'pandas groupby', 'pandas tutorial', 'python pandas tutorial']",665
6yNsc7JVPJE,Top 5 Biggest Mistakes Beginner Data Analysts Make,2023-03-28T11:30:04Z,39681,1794,82,"['Data Analyst', 'Data Analyst job', 'Data Analyst Career', 'Data Analytics', 'Alex The Analyst']",534
mBCG9J1TVTc,Indexes in Pandas | Python Pandas Tutorials,2023-03-21T11:30:30Z,71932,1625,51,"['Data Analyst', 'Data Analyst job', 'Data Analyst Career', 'Data Analytics', 'Alex The Analyst', 'pandas', 'pandas tutorial', 'coding', 'python', 'python pandas', 'index in pandas', 'pandas index', 'index pandas', 'how to use indexes in pandas']",682
WizLaDdsHUs,Create the Perfect Data Analyst Resume | Free Templates!,2023-03-14T11:30:10Z,226531,6224,248,"['Data Analyst', 'Data Analyst job', 'Data Analyst Career', 'Data Analytics', 'Alex The Analyst', 'data analyst resume', 'creating a resume', 'resume', 'resume for data analysis', 'resume for data analysts', 'how to create a resume', 'how to create a data analyst resume', 'resume for analysts']",1057
kB7FV-ijdqE,Filtering Columns and Rows in Pandas | Python Pandas Tutorials,2023-03-07T12:30:30Z,116312,2416,66,"['Data Analyst', 'Data Analyst job', 'Data Analyst Career', 'Data Analytics', 'Alex The Analyst', 'pandas', 'pandas python', 'coding', 'filtering pandas', 'ordering pandas', 'how to filter in pandas', 'how to order in pandas', 'pandas order by', 'pandas filter', 'pandas loc', 'pandas iloc']",709
dFA0E-6xT_M,Data Analyst Q/A Livestream | March Livestream | Ask Me Anything!,2023-03-02T16:27:46Z,11205,394,33,"['Data Analyst', 'Data Analyst job', 'Data Analyst Career', 'Data Analytics', 'Alex The Analyst', 'livestream']",5296
dUpyC40cF6Q,Reading in Files in Pandas | Python Pandas Tutorials,2023-02-28T12:30:18Z,236755,3854,115,"['Data Analyst', 'Data Analyst job', 'Data Analyst Career', 'Data Analytics', 'Alex The Analyst', 'Pandas', 'pandas python', 'python pandas', 'pandas tutorials', 'pandas tutorial', 'reading in files', 'python read in files', 'pandas read in file']",1157
gs0FNQR0njI,Building an Automated File Sorter in File Explorer using Python | Python Projects for Beginners,2023-02-21T12:32:29Z,78036,1721,92,"['Data Analyst', 'Data Analyst job', 'Data Analyst Career', 'Data Analytics', 'Alex The Analyst', 'python project', 'python project for beginners']",1011
C75TROiiEa0,ChatGPT for Data Analysts | Best Use Cases + Analyzing a Dataset,2023-02-14T12:30:08Z,448140,8314,222,"['Data Analyst', 'Data Analyst job', 'Data Analyst Career', 'Data Analytics', 'Alex The Analyst', 'Chat gpt', 'Chatgpt', 'Chatgpt for data analysis', 'data analyst using chatgpt', 'chatgpt 3.5', 'chatgpt for data analysts', 'data analyst chatgpt', 'chatgpt data analyst']",1867
rGx1QNdYzvs,FREE Data Analyst Bootcamp!!,2023-02-07T12:30:11Z,1911696,46550,1765,"['Data Analyst', 'Data Analyst job', 'Data Analyst Career', 'Data Analytics', 'Alex The Analyst', 'data analyst bootcamp', 'data analytics bootcamp', 'become a data nalyst', 'free bootcamp', 'free data bootcamp', 'free data analyst bootcamp']",412
CUBfrdDwznQ,How to Become a Data Analyst in 2023 (Completely FREE!),2023-01-31T12:30:06Z,1322913,43701,1318,"['Data Analyst', 'Data Analyst job', 'Data Analyst Career', 'Data Analytics', 'Alex The Analyst', 'data analyst 2023', 'how to become a data analyst', 'data analyst guide', 'guide to become a data analyst']",839
L-QnW_BZT3c,Live Portfolio Review with Alex the Analyst!  | Live Webinar,2023-01-25T17:14:49Z,17783,633,23,"['Data Analyst', 'Data Analyst job', 'Data Analyst Career', 'Data Analytics', 'Alex The Analyst']",4217
S76iS03nGis,DIY Data Analyst Curriculum using Udemy (Under $75),2023-01-24T12:30:13Z,41166,1474,121,"['Data Analyst', 'Data Analyst job', 'Data Analyst Career', 'Data Analytics', 'Alex The Analyst', 'diy data analyst curriculum using udemy', 'udemy courses', 'best udemy courses', 'data analyst udemy', 'build your own courses on udemy', 'udemy']",769
RBEgsEVO3T8,Reviewing Maven Analytics Free Portfolio Website,2023-01-17T12:30:08Z,28031,819,49,"['Data Analyst', 'Data Analyst job', 'Data Analyst Career', 'Data Analytics', 'Alex The Analyst', 'maven analytics', 'maven analytics data analyst', 'maven analytics showcase', 'maven analytics portfolio', 'maven analytics portfolio website', 'Portfolio on maven analytics']",1356
gCG07l6Fu-U,5 Study Hacks for Beginner Data Analysts! | Live Webinar,2023-01-16T17:25:08Z,46595,1357,36,"['Data Analyst', 'Data Analyst job', 'Data Analyst Career', 'Data Analytics', 'Alex The Analyst']",4650
DXwFsxCtukg,DIY Data Analyst Curriculum using Coursera in 2023,2023-01-10T12:30:03Z,65061,3023,222,"['Data Analyst', 'Data Analyst job', 'Data Analyst Career', 'Data Analytics', 'Alex The Analyst', 'coursera', 'data analyst courses', 'best coursera courses', 'diy data analyst curriculum coursera', 'cousera data analyst']",752
ey1VNjU0YbM,Building a BMI Calculator with Python | Python Projects for Beginners,2023-01-03T12:30:12Z,96536,1964,88,"['Data Analyst', 'Data Analyst job', 'Data Analyst Career', 'Data Analytics', 'Alex The Analyst', 'bmi calculator', 'python calculator', 'python bmi calculator', 'how to create a bmi calculator in python', 'how to create a bmi calculator']",863
0MKcCHrTo0c,"Reading, Writing, and Appending Files in Python | Python for Beginners",2022-12-27T13:00:00Z,10991,308,13,"['Data Analyst', 'Data Analyst job', 'Data Analyst Career', 'Data Analytics', 'Alex The Analyst', 'reading files in python', 'working with files in python', 'appending files in python', 'writing to files in python', 'python files']",564
bVJfQAe-UP4,Why I Quit my 125k Analytics Job,2022-12-20T12:00:33Z,158113,8713,858,"['Data Analyst', 'Data Analyst job', 'Data Analyst Career', 'Data Analytics', 'Alex The Analyst', 'quitting my job', 'why I quit my job', 'why I quit', 'quitting my analytics job', 'why I quit my analytics job', 'why I left', 'why I left my job', 'why I left my analytics job']",463
_2OknmkngkQ,Data Analyst Q/A Livestream + Special Guest! | December Livestream,2022-12-17T14:16:05Z,5104,166,15,"['Data Analyst', 'Data Analyst job', 'Data Analyst Career', 'Data Analytics', 'Alex The Analyst', 'livestream']",4968
B63bN2cLVLM,Converting Data Types in Python | Python for Beginners,2022-12-13T12:00:06Z,56438,1497,38,"['Data Analyst', 'Data Analyst job', 'Data Analyst Career', 'Data Analytics', 'Alex The Analyst', 'data types in python', 'converting data types in python', 'converting data types', 'python converting data types']",396
zvzjaqMBEso,Functions in Python | Python for Beginners,2022-12-06T12:00:36Z,87579,1986,42,"['Data Analyst', 'Data Analyst job', 'Data Analyst Career', 'Data Analytics', 'Alex The Analyst', 'functions', 'functions in python', 'how to use functions in python', 'python functions']",764
ECduJk00mUU,While Loops in Python | Python for Beginners,2022-11-29T12:00:07Z,87067,2140,35,"['Data Analyst', 'Data Analyst job', 'Data Analyst Career', 'Data Analytics', 'Alex The Analyst', 'while loops in python', 'python while loops', 'while loops', 'while loop in python', 'how to use a while loop', 'how to use a while loop in python']",340
zmIdC0_0BgY,For Loops in Python | Python for Beginners,2022-11-22T12:00:48Z,80656,1808,32,"['Data Analyst', 'Data Analyst job', 'Data Analyst Career', 'Data Analytics', 'Alex The Analyst', 'for loops in python', 'for loops', 'how to use for loops', 'how to use for loops in python', 'python for loops', 'for loop', 'for loop in python']",557
eP8-mo5jRrY,Data Analyst Q/A Livestream | November Livestream,2022-11-16T02:06:22Z,6308,199,18,"['Data Analyst', 'Data Analyst job', 'Data Analyst Career', 'Data Analytics', 'Alex The Analyst', 'livestream']",3737
-BOBedcjySI,If Else Statements in Python | Python for Beginners,2022-11-15T12:00:00Z,67550,1669,31,"['Data Analyst', 'Data Analyst job', 'Data Analyst Career', 'Data Analytics', 'Alex The Analyst', 'if statements in python', 'if else statements in python', 'if/else statements in python', 'python if else statements', 'if else statements', 'if/else statements', 'if/else python', 'python if/else']",400
lPVke-p4S7s,"Comparison, Logical, and Membership Operators in Python | Python for Beginners",2022-11-08T12:00:35Z,68587,1712,22,"['Data Analyst', 'Data Analyst job', 'Data Analyst Career', 'Data Analytics', 'Alex The Analyst', 'operators in python', 'logical operators in python', 'python operators', 'membership operators in python', 'comparison operators in python', 'python logical operators', 'python membership operators', 'python comparison operators', 'python for beginners']",435
ppsCxnNm-JI,Data Types in Python | Python for Beginners,2022-11-01T11:00:37Z,158288,3544,83,"['Data Analyst', 'Data Analyst job', 'Data Analyst Career', 'Data Analytics', 'Alex The Analyst', 'Data Types', 'Data Types in Python', 'Python Data Types', 'Types of data in python']",1318
rVhHGPDzEck,Data Analyst Q/A Livestream | October Livestream,2022-10-31T01:22:29Z,5741,182,11,"['Data Analyst', 'Data Analyst job', 'Data Analyst Career', 'Data Analytics', 'Alex The Analyst', 'livestream']",4498
pHOH7UfOhbE,Variables in Python | Python for Beginners,2022-10-25T11:00:27Z,149421,3152,73,"['Data Analyst', 'Data Analyst job', 'Data Analyst Career', 'Data Analytics', 'Alex The Analyst', 'python variables', 'variables in python', 'how to use variables', 'how to use variables in python', 'variables']",797
sXHIIW3Wt84,300k Livestream! | Giveaways for People in Chat | Bring Your Wine,2022-10-19T10:56:23Z,5276,243,23,"['Data Analyst', 'Data Analyst job', 'Data Analyst Career', 'Data Analytics', 'Alex The Analyst']",5064
WUeBzT43JyY,Installing Jupyter Notebooks/Anaconda | Python for Beginners,2022-10-18T11:00:30Z,486718,7017,188,"['Data Analyst', 'Data Analyst job', 'Data Analyst Career', 'Data Analytics', 'Alex The Analyst', 'python for beginners', 'how to install jupyter notebooks', 'how to install anaconda', 'how to use python', 'python']",603
DVs9u15htXU,Interviewing Tina Huang | Fellow YouTuber and Data Enthusiast,2022-10-13T11:00:07Z,9626,333,21,"['Data Analyst', 'Data Analyst job', 'Data Analyst Career', 'Data Analytics', 'Alex The Analyst', 'Tina Huang', 'Tina Huang YouTube', 'Tina Huang Interview', 'Interviewing Tina Huang']",1326
zW3qJUeJLWc,Interviewing Luke Barousse | Arch-Nemesis and Fellow YouTuber,2022-10-11T11:00:42Z,7590,335,31,"['Data Analyst', 'Data Analyst job', 'Data Analyst Career', 'Data Analytics', 'Alex The Analyst', 'Luke barrouse', 'luke barrouse data', 'luke barousse data analyst', 'luke barrouse interview', 'interviewing luke barousse']",1466
m1AkWK_ODLM,When Best Friends Work Together (ft. Luke Barousse),2022-10-04T10:30:09Z,16078,694,84,"['Data Analyst', 'Data Analyst job', 'Data Analyst Career', 'Data Analytics', 'Alex The Analyst', 'working with friends', 'when best friends work together']",335
Pfq-8pGzgg4,Data Analyst Live Stream | Riding out Hurricane Ian,2022-10-01T01:48:31Z,6783,212,8,"['Data Analyst', 'Data Analyst job', 'Data Analyst Career', 'Data Analytics', 'Alex The Analyst']",5588
pixlHHe_lNQ,Full Power BI Guided Project | Microsoft Power BI for Beginners,2022-09-27T10:30:19Z,529771,9841,518,"['Data Analyst', 'Data Analyst job', 'Data Analyst Career', 'Data Analytics', 'Alex The Analyst', 'full project in power bi', 'power bi project', 'full power bi project', 'real project in power bi', 'power bi real project', 'power bi', 'power bi tutorial', 'how to use power bi', 'power bi guided project', 'guided project in power bi']",2557
3NV5Jtbhfcw,Popular Visualizations in Power BI | Microsoft Power BI for Beginners,2022-09-20T10:30:00Z,155832,3332,72,"['Data Analyst', 'Data Analyst job', 'Data Analyst Career', 'Data Analytics', 'Alex The Analyst', 'power bi', 'power bi tutorial', 'how to use power bi', 'power bi visualization', 'power bi visualizations', 'different visualizations in power bi', 'popular visualizations in power bi']",854
1cfrQLoJMPI,"Guided Portfolio Projects on Coursera | Python, SQL, Excel, Power BI, and Tableau",2022-09-13T10:30:00Z,60053,2178,96,"['Data Analyst', 'Data Analyst job', 'Data Analyst Career', 'Data Analytics', 'Alex The Analyst', 'portfolio projects', 'portfolio projects for data analysts', 'data analyst portfolio projects', 'data science portfolio project', 'coursera guided projects', 'coursera portfolio projects']",501
9j_EBt3RNrs,How to use Bins and Lists in Power BI | Microsoft Power BI for Beginners,2022-09-06T10:30:02Z,133671,2825,56,"['Data Analyst', 'Data Analyst job', 'Data Analyst Career', 'Data Analytics', 'Alex The Analyst', 'Bins and Lists', 'Power BI Bins', 'Power BI Lists', 'How to use bins', 'how to use bins in power bi', 'how to use lists in power bi', 'power bi bins and lists']",571
m0h3Ghl6mgY,How to use Conditional Formatting in Power BI | Microsoft Power BI for Beginners,2022-08-30T10:30:10Z,217875,3318,65,"['Data Analyst job', 'Data Analyst Career', 'Data Analytics', 'Alex The Analyst', 'conditional formatting', 'conditional formatting in power bi', 'how to use conditional formatting in power bi', 'power bi conditional formatting', 'power bi tutorials', 'power bi tutorials for beginners']",594
50D__p6jdEI,Top 8 Mistakes Beginner Data Analyst's Make | CareerFoundry Webinar,2022-08-24T16:15:29Z,77526,2067,78,"['Data Analyst', 'Data Analyst job', 'Data Analyst Career', 'Data Analytics', 'Alex The Analyst']",4249
tRCGGlMI19M,Interviewing Ken Jee | The Face of Data Science on YouTube,2022-08-23T10:30:19Z,7341,255,15,"['Data Analyst', 'Data Analyst job', 'Data Analyst Career', 'Data Analytics', 'Alex The Analyst', 'Ken Jee', 'Ken Jee interview', 'Ken jee data science', 'ken jee youtube', 'ken jee data', 'interviewing ken jee']",1735
0QZBnhofU_U,CareerFoundry Data Analytics Bootcamp Review | Bootcamp + Intro + Free Course Review,2022-08-16T10:30:00Z,28624,676,130,"['Data Analyst', 'Data Analyst job', 'Data Analyst Career', 'Data Analytics', 'Alex The Analyst', 'careerfoundry', 'careerfoundry review', 'careerfoundry analytics', 'careerfoundry data analytics review', 'careerfoundry data analyst bootcamp', 'careerfoundry bootcamp review']",1361
ulFY20KTzFQ,How to use Drill Down in Power BI | Microsoft Power BI for Beginners,2022-08-09T10:30:11Z,259531,4340,92,"['Data Analyst', 'Data Analyst job', 'Data Analyst Career', 'Data Analytics', 'Alex The Analyst', 'drill down', 'drill down in power bi', 'how to drill down', 'how to use drill down', 'how to use drill down in power bi', 'power bi drill down', 'power bi drill down to another visual']",362
PEc29sRZoTM,"Best Courses for Alternative Analyst Jobs | Marketing Analyst, Business Analyst, Financial Analyst",2022-08-02T10:30:05Z,20826,876,75,"['Data Analyst', 'Data Analyst job', 'Data Analyst Career', 'Data Analytics', 'Alex The Analyst', 'courses for business analysts', 'courses for financial analysts', 'courses for sports analysts', 'courses for data analysts', 'courses for analysts', 'sports analyst', 'marketing analyst', 'marketing analyst courses', 'sports analyst courses', 'financial anlyst', 'financial analyst courses', 'business analyst', 'business analyst courses']",566
